{
  "agent_id": "L1-planning-feature-cycle-mapper",
  "agent_version": "3.1.0",
  "execution_id": "exec-280feb36-25f9-59d2-92bf-60fdb04af3fd",
  "workflow_execution_id": "wf-5f2a9c84-1d7e-4b60-a3f9-8e2c6d1b0a47",
  "status": "success",
  "content": {
    "type": "cycle_plan",
    "schema_version": "3.1",
    "items": {
      "feature_assignments": [
        {
          "feature_id": "F-01.1",
          "name": "Customer registration and login",
          "rank": 1,
          "effort": 5,
          "cycle_id": "C-01",
          "cycle_number": 1,
          "end_cycle_id": "C-01",
          "end_cycle_number": 1,
          "is_split": false,
          "stories": [],
          "depends_on_feature_ids": [],
          "is_mvp": true,
          "confidence": 0.9,
          "summary": "Rank 1 \u2192 C-01: fits one cycle (5 \u2264 8); no dependencies.",
          "citation": {
            "source_reference": "prioritized_backlog",
            "source_location": "prioritized_features[rank=1] F-01.1"
          }
        },
        {
          "feature_id": "F-01.2",
          "name": "Personal loan application form",
          "rank": 2,
          "effort": 5,
          "cycle_id": "C-02",
          "cycle_number": 2,
          "end_cycle_id": "C-02",
          "end_cycle_number": 2,
          "is_split": false,
          "stories": [],
          "depends_on_feature_ids": [
            "F-01.1"
          ],
          "is_mvp": true,
          "confidence": 0.9,
          "summary": "Rank 2 \u2192 C-02: fits one cycle (5 \u2264 8); after F-01.1.",
          "citation": {
            "source_reference": "prioritized_backlog",
            "source_location": "prioritized_features[rank=2] F-01.2"
          }
        },
        {
          "feature_id": "F-01.3",
          "name": "Income document upload with OCR extraction",
          "rank": 3,
          "effort": 6,
          "cycle_id": "C-03",
          "cycle_number": 3,
          "end_cycle_id": "C-03",
          "end_cycle_number": 3,
          "is_split": false,
          "stories": [],
          "depends_on_feature_ids": [
            "F-01.2"
          ],
          "is_mvp": true,
          "confidence": 0.9,
          "summary": "Rank 3 \u2192 C-03: fits one cycle (6 \u2264 8); after F-01.2.",
          "citation": {
            "source_reference": "prioritized_backlog",
            "source_location": "prioritized_features[rank=3] F-01.3"
          }
        },
        {
          "feature_id": "F-01.4",
          "name": "Credit bureau score check",
          "rank": 4,
          "effort": 3,
          "cycle_id": "C-04",
          "cycle_number": 4,
          "end_cycle_id": "C-04",
          "end_cycle_number": 4,
          "is_split": false,
          "stories": [],
          "depends_on_feature_ids": [
            "F-01.2"
          ],
          "is_mvp": true,
          "confidence": 0.9,
          "summary": "Rank 4 \u2192 C-04: fits one cycle (3 \u2264 8); after F-01.2; C-03 has no room, slipped to C-04.",
          "citation": {
            "source_reference": "prioritized_backlog",
            "source_location": "prioritized_features[rank=4] F-01.4"
          }
        },
        {
          "feature_id": "F-01.5",
          "name": "Underwriter review dashboard",
          "rank": 5,
          "effort": 5,
          "cycle_id": "C-05",
          "cycle_number": 5,
          "end_cycle_id": "C-05",
          "end_cycle_number": 5,
          "is_split": false,
          "stories": [],
          "depends_on_feature_ids": [
            "F-01.3",
            "F-01.4"
          ],
          "is_mvp": true,
          "confidence": 0.9,
          "summary": "Rank 5 \u2192 C-05: fits one cycle (5 \u2264 8); after F-01.3, F-01.4.",
          "citation": {
            "source_reference": "prioritized_backlog",
            "source_location": "prioritized_features[rank=5] F-01.5"
          }
        },
        {
          "feature_id": "F-02.3",
          "name": "Multilingual SMS notifications (Tamil, Hindi, English)",
          "rank": 8,
          "effort": 3,
          "cycle_id": "C-02",
          "cycle_number": 2,
          "end_cycle_id": "C-02",
          "end_cycle_number": 2,
          "is_split": false,
          "stories": [],
          "depends_on_feature_ids": [
            "F-01.1"
          ],
          "is_mvp": false,
          "confidence": 0.9,
          "summary": "Rank 8 \u2192 C-02: fits one cycle (3 \u2264 8); after F-01.1.",
          "citation": {
            "source_reference": "prioritized_backlog",
            "source_location": "prioritized_features[rank=8] F-02.3"
          }
        }
      ],
      "gaps": []
    },
    "execution_summary": "\u2022 Produced 6 feature assignments (0 split into 0 stories, 6 single-cycle with stories []), 0 gaps; 4 ranked features left out (not planned this PI).\n\u2022 Decision: F-02.3 SMS notifications shares C-02 with F-01.2 (5 + 3 = 8); it depends only on F-01.1, so no rank is broken.\n\u2022 Decision: F-01.4 could not join F-01.3 in C-03 (6 + 3 > 8) and slipped to C-04.\n\u2022 Decision: F-03.2 fraud scoring (effort 10 > 8) qualifies for a split, but Story B has no room in C-05, the last cycle, so the whole feature is left out rather than planning Story A alone.\n\u2022 Reflection: basic self-check confirmed 6 assignments, no duplicates, no cycle above capacity, all stories arrays empty.\n\u2022 Knowledge bases consulted: kb-L1-enterprise-architecture (bounded-context rule confirming epic_not_ready features need an ADR and EA approval before planning).\n\u2022 Guardrails: gr-L1-output-schema-validator pass; gr-L1-pii-detection pass (no personal data); gr-L3-hallucination-detector pass; gr-L3-citation-validator pass; gr-L3-consistency-checker pass.\n\u2022 Gaps: none.",
    "summary_table": "| Rank | Feature | Name | Effort | Cycle(s) | Split | Stories | Depends on | MVP |\n|---|---|---|---|---|---|---|---|---|\n| 1 | F-01.1 | Customer registration and login | 5 | C-01 | No | \u2014 | \u2014 | Yes |\n| 2 | F-01.2 | Personal loan application form | 5 | C-02 | No | \u2014 | F-01.1 | Yes |\n| 3 | F-01.3 | Income document upload with OCR extraction | 6 | C-03 | No | \u2014 | F-01.2 | Yes |\n| 4 | F-01.4 | Credit bureau score check | 3 | C-04 | No | \u2014 | F-01.2 | Yes |\n| 5 | F-01.5 | Underwriter review dashboard | 5 | C-05 | No | \u2014 | F-01.3, F-01.4 | Yes |\n| 8 | F-02.3 | Multilingual SMS notifications (Tamil, Hindi, English) | 3 | C-02 | No | \u2014 | F-01.1 | No |\n| | **Total** | 6 features | 27 | | 0 split | 0 stories | | |"
  }
}
