{
  "agent_id": "L1-planning-feature-cycle-mapper",
  "agent_version": "3.1.0",
  "execution_id": "exec-83f42213-b407-5774-82e1-45029bd69570",
  "workflow_execution_id": "wf-52d8e14d-289b-5d7b-b191-58ab049deb3c",
  "status": "failed",
  "content": {
    "type": "cycle_plan",
    "schema_version": "3.1",
    "items": {
      "feature_assignments": [],
      "gaps": [
        {
          "gap_id": "GAP-01",
          "type": "insufficient_context",
          "related_ids": [
            "prioritized_backlog"
          ],
          "summary": "prioritized_features is empty; nothing to assign to cycles.",
          "question": "Has L1-planning-backlog-prioritizer run for this PI? Please supply its prioritized_backlog output."
        }
      ]
    },
    "execution_summary": "\u2022 Produced 0 items \u2014 INSUFFICIENT_CONTEXT.\n\u2022 prioritized_backlog.content.items.prioritized_features is empty.\n\u2022 Reflection: confirmed no assignments were generated from the cadence alone.\n\u2022 Knowledge bases consulted: none (validation failed before processing).\n\u2022 Guardrails: gr-L1-output-schema-validator pass; gr-L1-pii-detection pass.\n\u2022 Suggested: rerun the backlog prioritizer, then this agent.",
    "summary_table": "No features assigned \u2014 see gaps."
  }
}
